url,occupation,soc_code,occupation_description,sample_of_reported_job_titles
https://www.onetonline.org/link/details/51-7032.00,"Patternmakers, Wood",51-7032.00,"Plan, lay out, and construct wooden unit or sectional patterns used in forming sand molds for castings.","Mold Maker, Pattern Engineer, Pattern Maker, Patternmaker, Wood Pattern Maker, Wood Patternmaker, Wood Shop Moldmaker, Woodshop Worker"
https://www.onetonline.org/link/details/47-2071.00,"Paving, Surfacing, and Tamping Equipment Operators",47-2071.00,"Operate equipment used for applying concrete, asphalt, or other materials to road beds, parking lots, or airport runways and taxiways or for tamping gravel, dirt, or other materials. Includes concrete and asphalt paving machine operators, form tampers, tamping machine operators, and stone spreader operators.","Asphalt Paver Operator, Asphalt Paving Machine Operator, Asphalt Raker, Asphalt Roller Operator, Equipment Operator (EO), Loader Operator, Maintenance Equipment Operator (MEO), Paver Operator, Roller Operator, Screed Operator"
https://www.onetonline.org/link/details/43-3051.00,Payroll and Timekeeping Clerks,43-3051.00,"Compile and record employee time and payroll data. May compute employees' time worked, production, and commission. May compute and post wages and deductions, or prepare paychecks.","Payroll Assistant, Payroll Clerk, Payroll Coordinator, Payroll Representative, Payroll Specialist, Payroll Technician, Personnel Assistant, Personnel Technician, Timekeeper"
https://www.onetonline.org/link/details/29-1243.00,Pediatric Surgeons,29-1243.00,"Diagnose and perform surgery to treat fetal abnormalities and birth defects, diseases, and injuries in fetuses, premature and newborn infants, children, and adolescents. Includes all pediatric surgical specialties and subspecialties.","Cardiovascular Surgeon, General Surgeon, Hand Surgeon, Physician, Plastic Surgeon, Surgeon, Thoracic Surgeon, Vascular Surgeon"
https://www.onetonline.org/link/details/29-1221.00,"Pediatricians, General",29-1221.00,"Diagnose, treat, and help prevent diseases and injuries in children. May refer patients to specialists for further diagnosis or treatment, as needed.","Developmental Pediatrician, Emergency Room Pediatrician (ER Pediatrician), General Pediatrician, Group Practice Pediatrician, Medical Doctor (MD), Pediatric Emergency Medicine Physician, Pediatric Physician, Physician, Primary Care Pediatrician"
https://www.onetonline.org/link/details/15-1299.04,Penetration Testers,15-1299.04,Evaluate network system security by conducting simulated internal and external cyberattacks using adversary tools and techniques. Attempt to breach and exploit critical systems and gain access to sensitive information to assess system security.,
https://www.onetonline.org/link/details/31-1122.00,Personal Care Aides,31-1122.00,"Provide personalized assistance to individuals with disabilities or illness who require help with personal care and activities of daily living support (e.g., feeding, bathing, dressing, grooming, toileting, and ambulation). May also provide help with tasks such as preparing meals, doing light housekeeping, and doing laundry. Work is performed in various settings depending on the needs of the care recipient and may include locations such as their home, place of work, out in the community, or at a daytime nonresidential facility.","Care Provider, Caregiver, Direct Care Worker, Home Care Aide, Medication Aide, Personal Care Aide, Personal Care Assistant (PCA), Personal Care Attendant (PCA), Resident Assistant, Resident Care Assistant (RCA)"
https://www.onetonline.org/link/details/39-9099.00,"Personal Care and Service Workers, All Other",39-9099.00,All personal care and service workers not listed separately.,
https://www.onetonline.org/link/details/13-2052.00,Personal Financial Advisors,13-2052.00,"Advise clients on financial plans using knowledge of tax and investment strategies, securities, insurance, pension plans, and real estate. Duties include assessing clients' assets, liabilities, cash flow, insurance coverage, tax status, and financial objectives. May also buy and sell financial assets for clients.","Certified Financial Planner (CFP), Financial Advisor, Financial Consultant, Financial Counselor, Financial Life Planner, Financial Planner, Investment Advisor, Portfolio Manager, Wealth Advisor, Wealth Manager"
https://www.onetonline.org/link/details/11-9179.00,"Personal Service Managers, All Other",11-9179.00,All personal service managers not listed separately.,
https://www.onetonline.org/link/details/37-2021.00,Pest Control Workers,37-2021.00,Apply or release chemical solutions or toxic gases and set traps to kill or remove pests and vermin that infest buildings and surrounding areas.,"Certified Pest Control Technician, Commercial Pest Control Technician, Exterminator, Pest Control Applicator, Pest Control Chemical Technician, Pest Control Operator, Pest Control Technician (Pest Control Tech), Pest Technician, Residential Pest Control Technician, Termite Technician"
https://www.onetonline.org/link/details/37-3012.00,"Pesticide Handlers, Sprayers, and Applicators, Vegetation",37-3012.00,"Mix or apply pesticides, herbicides, fungicides, or insecticides through sprays, dusts, vapors, soil incorporation, or chemical application on trees, shrubs, lawns, or crops. Usually requires specific training and state or federal certification.","Chemical Applicator, Integrated Pest Management Technician (IPM Technician), Lawn Specialist, Lawn Technician, Licensed Pesticide Applicator, Pest Control Technician, Pesticide Applicator, Spray Applicator, Spray Technician, Tree and Shrub Technician"
https://www.onetonline.org/link/details/17-2171.00,Petroleum Engineers,17-2171.00,Devise methods to improve oil and gas extraction and production and determine the need for new or modified tool designs. Oversee drilling and offer technical advice.,"Completion Engineer, Drilling Engineer, Engineer, Operations Engineer, Petroleum Engineer, Petroleum Production Engineer, Project Production Engineer, Project Reservoir Engineer, Reservoir Engineer, Reservoir Engineering Consultant"
https://www.onetonline.org/link/details/51-8093.00,"Petroleum Pump System Operators, Refinery Operators, and Gaugers",51-8093.00,"Operate or control petroleum refining or processing units. May specialize in controlling manifold and pumping systems, gauging or testing oil in storage tanks, or regulating the flow of oil into pipelines.","Board Operator, Crude Unit Operator, Gauger, Hydrotreater Operator, Operator, Outside Operator, Pumper, Refinery Operator, Stillman, Unit Operator"
https://www.onetonline.org/link/details/29-1051.00,Pharmacists,29-1051.00,"Dispense drugs prescribed by physicians and other health practitioners and provide information to patients about medications and their use. May advise physicians and other health practitioners on the selection, dosage, interactions, and side effects of medications.","Clinical Pharmacist, Hospital Pharmacist, Informatics Pharmacist, Pharm D (Pharmacy Doctor), Pharmacist in Charge (PIC), Pharmacy Coordinator, Pharmacy Informaticist, Pharmacy Services Clinical Coordinator, Registered Pharmacist, Retail Pharmacist"
https://www.onetonline.org/link/details/31-9095.00,Pharmacy Aides,31-9095.00,"Record drugs delivered to the pharmacy, store incoming merchandise, and inform the supervisor of stock needs. May operate cash register and accept prescriptions for filling.","Certified Pharmacist Assistant, Drug Purchaser, Front Counter Clerk, Pharmacist Assistant, Pharmacy Aide, Pharmacy Ancillary, Pharmacy Assistant, Pharmacy Cashier, Pharmacy Clerk"
https://www.onetonline.org/link/details/29-2052.00,Pharmacy Technicians,29-2052.00,"Prepare medications under the direction of a pharmacist. May measure, mix, count out, label, and record amounts and dosages of medications according to prescription orders.","Accredited Pharmacy Technician, Certified Pharmacy Technician (CPhT), Chemotherapy Pharmacy Technician (Chemo Pharmacy Technician), Compounding Technician, OR Pharmacy Tech (Operating Room Pharmacy Tech), RPhT (Registered Pharmacy Technician)"
https://www.onetonline.org/link/details/25-1126.00,"Philosophy and Religion Teachers, Postsecondary",25-1126.00,"Teach courses in philosophy, religion, and theology. Includes both teachers primarily engaged in teaching and those who do a combination of teaching and research.","Assistant Professor, Associate Professor, Humanities Professor, Instructor, Philosophy Instructor, Philosophy Professor, Professor, Religion Professor, Religious Studies Professor, Theology Professor"
https://www.onetonline.org/link/details/31-9097.00,Phlebotomists,31-9097.00,"Draw blood for tests, transfusions, donations, or research. May explain the procedure to patients and assist in the recovery of patients with adverse reactions.","Lab Liaison Technician, Mobile Examiner, Patient Service Technician (PST), Phlebotomist, Phlebotomy Technician, Registered Phlebotomist"
https://www.onetonline.org/link/details/27-4021.00,Photographers,27-4021.00,"Photograph people, landscapes, merchandise, or other subjects. May use lighting equipment to enhance a subject's appearance. May use editing software to produce finished images and prints. Includes commercial and industrial photographers, scientific photographers, and photojournalists.","Advertising Photographer, Commercial Photographer, Graduation Photographer, Newspaper Photographer, Photo Editor, Photographer, Photojournalist, Portrait Photographer, Sports Photographer, Studio Photographer"
https://www.onetonline.org/link/details/51-9151.00,Photographic Process Workers and Processing Machine Operators,51-9151.00,Perform work involved in developing and processing photographic images from film or digital media. May perform precision tasks such as editing photographic negatives and prints.,"Digital Printer Operator, Film Processor, Film Technician, Lab Technician, Photo Lab Specialist, Photo Lab Technician (Photographic Laboratory Technician), Photo Printer, Photo Specialist, Photo Technician"
https://www.onetonline.org/link/details/17-2199.07,Photonics Engineers,17-2199.07,"Design technologies specializing in light information or light energy, such as laser or fiber optics technology.","Algorithm Developer, Laser Engineer, Optical Design Engineer, Optical Engineer, Optical Specialist, Optical Systems Engineer, Optoelectronics Engineer, Research and Development Engineer (R and D Engineer), Research Engineer"
https://www.onetonline.org/link/details/17-3029.08,Photonics Technicians,17-3029.08,"Build, install, test, or maintain optical or fiber optic equipment, such as lasers, lenses, or mirrors, using spectrometers, interferometers, or related equipment.","Fiber Optics Instructor, Fiber Optics Technician (Fiber Optics Tech), Laser Technician (Laser Tech), Optics Technician (Optics Tech), Optomechanical Technician (Optomechanical Tech), Photonics Laboratory Technician (Photonics Lab Tech), Photonics Technician (Photonics Tech), Ruling Technician (Ruling Tech)"
https://www.onetonline.org/link/details/29-1229.04,Physical Medicine and Rehabilitation Physicians,29-1229.04,"Diagnose and treat disorders requiring physiotherapy to provide physical, mental, and occupational rehabilitation.","MD (Medical Doctor), Medical Director Acute Rehabilitation Unit Physiatrist, Pain Management Physician, Pediatric Physiatrist, Physiatrist, Physical Medicine and Rehabilitation Physician (PM and R Physician), Physician, Rehabilitation Physician"
https://www.onetonline.org/link/details/19-2099.00,"Physical Scientists, All Other",19-2099.00,All physical scientists not listed separately.,
https://www.onetonline.org/link/details/31-2022.00,Physical Therapist Aides,31-2022.00,"Under close supervision of a physical therapist or physical therapy assistant, perform only delegated, selected, or routine tasks in specific situations. These duties include preparing the patient and the treatment area.","Physical Therapist Aide (PTA), Physical Therapy Aide (PTA), PT Attendant (Physical Therapy Attendant), PT Tech (Physical Therapist Technician), PT Tech (Physical Therapy Technician), Rehabilitation Aide, Rehabilitation Attendant, Rehabilitation Technician (Rehabilitation Tech), Restorative Aide (RA), Therapy Aide"
https://www.onetonline.org/link/details/31-2021.00,Physical Therapist Assistants,31-2021.00,"Assist physical therapists in providing physical therapy treatments and procedures. May, in accordance with state laws, assist in the development of treatment plans, carry out routine functions, document the progress of treatment, and modify specific treatments in accordance with patient status and within the scope of treatment plans established by a physical therapist. Generally requires formal training.","Certified Physical Therapist Assistant (CPTA), Home Care Physical Therapy Assistant, Home Health Physical Therapist Assistant, Licensed Physical Therapist Assistant (LPTA), Licensed Physical Therapy Assistant, Outpatient Physical Therapist Assistant, Per Diem Physical Therapist Assistant (Per Diem PTA), Physical Therapist Assistant (PTA), Physical Therapy Assistant (PTA)"
https://www.onetonline.org/link/details/29-1123.00,Physical Therapists,29-1123.00,"Assess, plan, organize, and participate in rehabilitative programs that improve mobility, relieve pain, increase strength, and improve or correct disabling conditions resulting from disease or injury.","Acute Care PT (Acute Care Physical Therapist), Doctor of Physical Therapy (DPT), Home Care Physical Therapist (Home Care PT), Inpatient Physical Therapist (Inpatient PT), Outpatient Physical Therapist (Outpatient PT), Pediatric Physical Therapist (Pediatric PT), Registered Physical Therapist (RPT), Therapist"
https://www.onetonline.org/link/details/29-1071.00,Physician Assistants,29-1071.00,"Provide healthcare services typically performed by a physician, under the supervision of a physician. Conduct complete physicals, provide treatment, and counsel patients. May, in some cases, prescribe medication. Must graduate from an accredited educational program for physician assistants.","Cardiology Physician Assistant, Certified Physician Assistant (PA-C), Emergency Medicine Physician Assistant (Emergency Medicine PA), Family Practice Physician Assistant, Orthopaedic Physician Assistant, Orthopedic Physician Assistant, Physician Assistant (PA), Physician's Assistant, Surgical Critical Care Physician Assistant (Surgical Critical Care PA), Surgical Physician Assistant (Surgical PA)"
https://www.onetonline.org/link/details/29-1229.00,"Physicians, All Other",29-1229.00,All physicians not listed separately.,
https://www.onetonline.org/link/details/29-1222.00,"Physicians, Pathologists",29-1222.00,"Diagnose diseases and conduct lab tests using organs, body tissues, and fluids. Includes medical examiners.","Anatomic Pathologist, Cytopathologist, Dermatopathologist, Forensic Pathologist, Hematopathologist, Neuropathologist, Oral Pathologist, Pathologist, Surgical Pathologist"
https://www.onetonline.org/link/details/19-2012.00,Physicists,19-2012.00,"Conduct research into physical phenomena, develop theories on the basis of observation and experiments, and devise methods to apply physical laws and theories.","Biophysics Scientist, Health Physicist, Medical Physicist, Physicist, Research Consultant, Research Physicist, Research Scientist, Scientist"
https://www.onetonline.org/link/details/25-1054.00,"Physics Teachers, Postsecondary",25-1054.00,Teach courses pertaining to the laws of matter and energy. Includes both teachers primarily engaged in teaching and those who do a combination of teaching and research.,"Adjunct Professor, Assistant Professor, Associate Professor, Instructor, Physical Science Professor, Physics Instructor, Physics Lecturer, Physics Professor, Professor, Science Instructor"
https://www.onetonline.org/link/details/47-2072.00,Pile Driver Operators,47-2072.00,"Operate pile drivers mounted on skids, barges, crawler treads, or locomotive cranes to drive pilings for retaining walls, bulkheads, and foundations of structures such as buildings, bridges, and piers.","Pile Driver, Pile Driver Operator, Pile Driving Operator"
https://www.onetonline.org/link/details/47-2151.00,Pipelayers,47-2151.00,"Lay pipe for storm or sanitation sewers, drains, and water mains. Perform any combination of the following tasks: grade trenches or culverts, position pipe, or seal joints.","Pipelayer, Tailman, Waste Water Worker"
https://www.onetonline.org/link/details/51-8099.00,"Plant and System Operators, All Other",51-8099.00,All plant and system operators not listed separately.,
https://www.onetonline.org/link/details/47-2161.00,Plasterers and Stucco Masons,47-2161.00,"Apply interior or exterior plaster, cement, stucco, or similar materials. May also set ornamental plaster.","Applicator, Artisan Plasterer, Plaster and Stucco Worker, Plaster Applicator, Plaster Mechanic, Plasterer, Plasterer Journeyman, Plastering Contractor"
https://www.onetonline.org/link/details/51-4193.00,"Plating Machine Setters, Operators, and Tenders, Metal and Plastic",51-4193.00,"Set up, operate, or tend plating machines to coat metal or plastic products with chromium, zinc, copper, cadmium, nickel, or other metal to protect or decorate surfaces. Typically, the product being coated is immersed in molten metal or an electrolytic solution.","Anodizer, Anodizing Line Operator, Chrome Plater, Coater Associate, Coater Operator, Electro Plater, Galvanizer, Line Operator, Machine Operator, Plater"
https://www.onetonline.org/link/details/47-2152.00,"Plumbers, Pipefitters, and Steamfitters",47-2152.00,"Assemble, install, alter, and repair pipelines or pipe systems that carry water, steam, air, or other liquids or gases. May install heating and cooling equipment and mechanical control systems. Includes sprinkler fitters.","Drain Technician, Fire Sprinkler Service Technician, Pipe Welder, Pipefitter, Plumber, Plumbing Installer, Residential Plumber, Service Plumber, Sprinkler Fitter, Steamfitter"
https://www.onetonline.org/link/details/29-1081.00,Podiatrists,29-1081.00,Diagnose and treat diseases and deformities of the human foot.,"Attending Physician, Doctor of Podiatric Medicine (DPM), Doctor of Podiatric Medicine and Surgery (DPM and Surgery), Doctor Podiatric Medicine (DPM), Foot and Ankle Surgeon, Physician, Podiatric Physician, Podiatric Surgeon, Podiatrist"
https://www.onetonline.org/link/details/27-3043.05,"Poets, Lyricists and Creative Writers",27-3043.05,"Create original written works, such as scripts, essays, prose, poetry or song lyrics, for publication or performance.","Author, Creative Writer, Fiction Writer, Freelance Writer, Librettist, Lyricist, Nonfiction Writer, Novelist, Poet, Songwriter"
https://www.onetonline.org/link/details/33-3051.00,Police and Sheriff's Patrol Officers,33-3051.00,"Maintain order and protect life and property by enforcing local, tribal, state, or federal laws and ordinances. Perform a combination of the following duties: patrol a specific area; direct traffic; issue traffic summonses; investigate accidents; apprehend and arrest suspects, or serve legal processes of courts. Includes police officers working at educational institutions.","Deputy, Deputy Sheriff, Law Enforcement Officer, Patrol Deputy, Patrol Officer, Peace Officer, Police Officer, Police Patrol Officer, Public Safety Officer, State Trooper"
https://www.onetonline.org/link/details/33-3021.02,Police Identification and Records Officers,33-3021.02,"Collect evidence at crime scene, classify and identify fingerprints, and photograph evidence for use in criminal and civil cases.","Crime Scene Evidence Technician, Crime Scene Investigator, Crime Scene Technician, Criminalist, Field Identification Specialist, Forensic Specialist, Identification Officer, Identification Technician, Latent Fingerprint Examiner, Latent Print Examiner"
https://www.onetonline.org/link/details/25-1065.00,"Political Science Teachers, Postsecondary",25-1065.00,"Teach courses in political science, international affairs, and international relations. Includes both teachers primarily engaged in teaching and those who do a combination of teaching and research.","Adjunct Professor, Assistant Professor, Associate Professor, Faculty Member, Government Professor, Instructor, Political Science Instructor, Political Science Professor, Professor, Public Administration Professor"
https://www.onetonline.org/link/details/19-3094.00,Political Scientists,19-3094.00,"Study the origin, development, and operation of political systems. May study topics, such as public opinion, political decisionmaking, and ideology. May analyze the structure and operation of governments, as well as various political entities. May conduct public opinion surveys, analyze election results, or analyze public documents.",
https://www.onetonline.org/link/details/43-5051.00,Postal Service Clerks,43-5051.00,"Perform any combination of tasks in a United States Postal Service (USPS) post office, such as receive letters and parcels; sell postage and revenue stamps, postal cards, and stamped envelopes; fill out and sell money orders; place mail in pigeon holes of mail rack or in bags; and examine mail for correct postage. Includes postal service clerks employed by USPS contractors.","Bulk Mail Technician, Clerk, Distribution Clerk, Part Time Flexible Clerk (PTF Clerk), Postal Clerk, Sales and Distribution Clerk, Sales and Service Associate (SSA), Window Clerk"
https://www.onetonline.org/link/details/43-5052.00,Postal Service Mail Carriers,43-5052.00,Sort and deliver mail for the United States Postal Service (USPS). Deliver mail on established route by vehicle or on foot. Includes postal service mail carriers employed by USPS contractors.,"City Carrier, City Carrier Assistant (CCA), City Letter Carrier, City Mail Carrier, Letter Carrier, Mail Carrier, Rural Carrier, Rural Carrier Associate (RCA), Rural Mail Carrier, Rural Route Carrier"
https://www.onetonline.org/link/details/43-5053.00,"Postal Service Mail Sorters, Processors, and Processing Machine Operators",43-5053.00,"Prepare incoming and outgoing mail for distribution for the United States Postal Service (USPS). Examine, sort, and route mail. Load, operate, and occasionally adjust and repair mail processing, sorting, and canceling machinery. Keep records of shipments, pouches, and sacks, and perform other duties related to mail handling within the postal service. Includes postal service mail sorters and processors employed by USPS contractors.","Automation Clerk, Computer Forwarding System Markup Clerk (CFS Markup Clerk), Distribution Clerk, Flat Sorting Machine Clerk (FSM Clerk), Mail Handler, Mail Handler Equipment Operator, Mail Processing Clerk, Mail Processor, Parcel Post Distribution Machine Operator (PDPMO), Small Package and Bundle Sorter Clerk (SPBS Clerk)"
https://www.onetonline.org/link/details/11-9131.00,Postmasters and Mail Superintendents,11-9131.00,"Plan, direct, or coordinate operational, administrative, management, and support services of a U.S. post office; or coordinate activities of workers engaged in postal and related work in assigned post office.","Delivery Supervisor, Distribution Operation Supervisor (SDO), Distribution Operations Manager, Distribution Operations Supervisor, Mail Delivery Supervisor, Postal Supervisor, Postmaster, Postmaster Relief (PMR), Remote Encoding Center Manager, Remote Encoding Operations Supervisor"
https://www.onetonline.org/link/details/25-1199.00,"Postsecondary Teachers, All Other",25-1199.00,All postsecondary teachers not listed separately.,
https://www.onetonline.org/link/details/51-9195.05,"Potters, Manufacturing",51-9195.05,"Operate production machines such as pug mill, jigger machine, or potter's wheel to process clay in manufacture of ceramic, pottery and stoneware products.","Clay Mixer, Glazer, Jigger Artisan, Jigger Machine Operator, Jiggerman, Kiln Worker, Potter, Pottery Manufacturer, Production Potter, Pugmill Operator"
https://www.onetonline.org/link/details/51-4052.00,"Pourers and Casters, Metal",51-4052.00,Operate hand-controlled mechanisms to pour and regulate the flow of molten metal into molds to produce castings or ingots.,"Caster, Casting Machine Operator, Casting Operator, DC Caster (Direct Chill Caster), Die Cast Machine Operator, Die Casting Machine Operator, Iron Pourer, Melter, Metal Handler, Pourer"
https://www.onetonline.org/link/details/51-8012.00,Power Distributors and Dispatchers,51-8012.00,"Coordinate, regulate, or distribute electricity or steam.","Control Area Operator, Control Operator, Dispatcher, Distribution System Dispatcher (DSD), DSO (Distribution System Operator), Electric System Operator, Power System Dispatcher, Power System Operator, Systems Operator, Transmission System Operator (TSO)"
https://www.onetonline.org/link/details/51-8013.00,Power Plant Operators,51-8013.00,"Control, operate, or maintain machinery to generate electric power. Includes auxiliary equipment operators.","Auxiliary Operator, Control Operator, Control Room Operator, Multicraft Operator (MCO), Operations and Maintenance Technician (O and M Tech), Plant Control Operator, Plant Operator, Power Plant Operator, Station Operator, Unit Operator"
