url,occupation,soc_code,occupation_description,sample_of_reported_job_titles
https://www.onetonline.org/link/details/15-1299.09,Information Technology Project Managers,15-1299.09,"Plan, initiate, and manage information technology (IT) projects. Lead and guide the work of technical staff. Serve as liaison between business and technical aspects of projects. Plan project stages and assess business implications for each stage. Monitor progress to assure deadlines, standards, and cost targets are met.","Cloud Product Director, Cybersecurity Project Manager, Data Center Product Director, Information Systems Project Manager (IS Project Manager), IT Manager (Information Technology Manager), IT Program Manager (Information Technology Program Manager), IT Project Manager (Information Technology Project Manager), Scrum Master, Transition Program Manager"
https://www.onetonline.org/link/details/51-9061.00,"Inspectors, Testers, Sorters, Samplers, and Weighers",51-9061.00,"Inspect, test, sort, sample, or weigh nonagricultural raw materials or processed, machined, fabricated, or assembled parts or products for defects, wear, and deviations from specifications. May use precision measuring instruments and complex test equipment.","Inspector, QA Auditor (Quality Assurance Auditor), QA Inspector (Quality Assurance Inspector), QA Technician (Quality Assurance Technician), QC Technician (Quality Control Technician), Quality Auditor, Quality Control Inspector (QC Inspector), Quality Inspector, Quality Technician, Test Technician"
https://www.onetonline.org/link/details/49-9099.00,"Installation, Maintenance, and Repair Workers, All Other",49-9099.00,"All installation, maintenance, and repair workers not listed separately.",
https://www.onetonline.org/link/details/25-9031.00,Instructional Coordinators,25-9031.00,"Develop instructional material, coordinate educational content, and incorporate current technology into instruction in order to provide guidelines to educators and instructors for developing curricula and conducting courses. May train and coach teachers. Includes educational consultants and specialists, and instructional material directors.","Curriculum and Instruction Director, Curriculum Coordinator, Curriculum Director, Curriculum Specialist, Education Specialist, Instructional Designer, Instructional Systems Specialist, Instructional Technologist, Learning Development Specialist, Program Administrator"
https://www.onetonline.org/link/details/47-2131.00,"Insulation Workers, Floor, Ceiling, and Wall",47-2131.00,"Line and cover structures with insulating materials. May work with batt, roll, or blown insulation materials.","Attic Blower, Insulation Estimator, Insulation Installer, Insulation Mechanic, Insulation Worker, Insulator, Retrofit Installer, Spray Foam Installer, Warehouse Insulation Worker"
https://www.onetonline.org/link/details/47-2132.00,"Insulation Workers, Mechanical",47-2132.00,"Apply insulating materials to pipes or ductwork, or other mechanical systems in order to help control and maintain temperature.","Commercial Insulator, Heat and Frost Insulator, Industrial Insulator, Insulation Installer, Insulation Mechanic, Insulation Worker, Insulator, Insulator Journeyman, Mechanic Insulator, Mechanical Insulator"
https://www.onetonline.org/link/details/13-1032.00,"Insurance Appraisers, Auto Damage",13-1032.00,Appraise automobile or other vehicle damage to determine repair costs for insurance claim settlement. Prepare insurance forms to indicate repair cost or cost estimates and recommendations. May seek agreement with automotive repair shop on repair costs.,"Appraiser, Automobile Appraiser (Auto Appraiser), Automobile Damage Appraiser (Auto Damage Appraiser), Damage Appraiser, Field Appraiser, Field Inspector, Insurance Appraiser, Material Damage Appraiser, Outside Physical Damage Appraiser, Physical Damage Appraiser"
https://www.onetonline.org/link/details/43-9041.00,Insurance Claims and Policy Processing Clerks,43-9041.00,"Process new insurance policies, modifications to existing policies, and claims forms. Obtain information from policyholders to verify the accuracy and completeness of information on claims forms, applications and related documents, and company records. Update existing policies and company records to reflect changes requested by policyholders and insurance company representatives.","Claims Adjudicator, Claims Analyst, Claims Clerk, Claims Customer Service Representative (Claims CSR), Claims Processor, Claims Representative (Claims Rep), Claims Technician (Claims Tech), Insurance Analyst, Policy Analyst, Underwriting Assistant"
https://www.onetonline.org/link/details/41-3021.00,Insurance Sales Agents,41-3021.00,"Sell life, property, casualty, health, automotive, or other types of insurance. May refer clients to independent brokers, work as an independent broker, or be employed by an insurance company.","Insurance Agent, Insurance Broker, Insurance Sales Agent, Sales Agent, Sales Associate, Sales Representative, Underwriting Sales Representative"
https://www.onetonline.org/link/details/13-2053.00,Insurance Underwriters,13-2053.00,Review individual applications for insurance to evaluate degree of risk involved and determine acceptance of applications.,"Account Underwriter, Automobile and Property Underwriter, Commercial Lines Underwriter, Health Underwriter, Life Underwriter, Personal Lines Underwriter, Underwriter, Underwriting Consultant"
https://www.onetonline.org/link/details/33-3021.06,Intelligence Analysts,33-3021.06,"Gather, analyze, or evaluate information from a variety of sources, such as law enforcement databases, surveillance, intelligence networks or geographic information systems. Use intelligence data to anticipate and prevent organized crime activities, such as terrorism.","Anti-Terrorist Analyst, Crime Analyst (Criminal Analyst), Crime and Intelligence Analyst (Criminal and Intelligence Analyst), Crime Intelligence Analyst (Criminal Intelligence Analyst), Crime Research Specialist (Criminal Research Specialist), Intel Analyst (Intelligence Analyst), Intel Research Specialist (Intelligence Research Specialist), Investigative Intel Analysts (Investigative Intelligence Analysts), Police Crime and Intel Analyst (Police Crime and Intelligence Analyst), Terrorism Research Specialist"
https://www.onetonline.org/link/details/27-1025.00,Interior Designers,27-1025.00,"Plan, design, and furnish the internal space of rooms or buildings. Design interior environments or create physical layouts that are practical, aesthetic, and conducive to the intended purposes. May specialize in a particular field, style, or phase of interior design.","Certified Kitchen Designer, Color and Materials Designer, Commercial Interior Designer, Decorating Consultant, Designer, Interior Decorator, Interior Design Consultant, Interior Design Coordinator, Interior Designer, Registered Interior Designer"
https://www.onetonline.org/link/details/27-3091.00,Interpreters and Translators,27-3091.00,"Interpret oral or sign language, or translate written text from one language into another.","American Sign Language Interpreter (ASL Interpreter), Court Interpreter, Educational Interpreter, Interpreter, Linguist, Medical Interpreter, Sign Language Interpreter, Spanish Interpreter, Spanish Translator, Translator"
https://www.onetonline.org/link/details/43-4111.00,"Interviewers, Except Eligibility and Loan",43-4111.00,"Interview persons by telephone, mail, in person, or by other means for the purpose of completing forms, applications, or questionnaires. Ask specific questions, record answers, and assist persons with completing form. May sort, classify, and file forms.","Admissions Clerk, Admissions Representative, Admitting Representative, Data Collection Assistant, Interviewer, Market Research Interviewer, Registration Clerk, Research Interviewer, Survey Interviewer, Telephone Interviewer"
https://www.onetonline.org/link/details/11-3031.03,Investment Fund Managers,11-3031.03,"Plan, direct, or coordinate investment strategy or operations for a large pool of liquid assets supplied by institutional investors or individual investors.","Fixed Income Portfolio Manager, Fixed Income Vice President (Fixed Income VP), Investment Analysis Vice President (Investment Analysis VP), Portfolio Manager"
https://www.onetonline.org/link/details/37-2011.00,"Janitors and Cleaners, Except Maids and Housekeeping Cleaners",37-2011.00,"Keep buildings in clean and orderly condition. Perform heavy cleaning duties, such as cleaning floors, shampooing rugs, washing walls and glass, and removing rubbish. Duties may include tending furnace and boiler, performing routine maintenance activities, notifying management of need for repairs, and cleaning snow or debris from sidewalk.","Building Custodian, Building Services Technician (Building Services Tech), Building Services Worker, Cleaner, Custodial Worker, Custodian, Facilities Worker, Heavy Duty Custodian, Janitor, School Custodian"
https://www.onetonline.org/link/details/51-9071.00,Jewelers and Precious Stone and Metal Workers,51-9071.00,"Design, fabricate, adjust, repair, or appraise jewelry, gold, silver, other precious metals, or gems.","Artist, Bench Jeweler, Caster, Earrings Fabricator, Gemologist, Goldsmith, Jeweler, Platinum Smith, Restoration Silversmith, Silversmith"
https://www.onetonline.org/link/details/23-1023.00,"Judges, Magistrate Judges, and Magistrates",23-1023.00,"Arbitrate, advise, adjudicate, or administer justice in a court of law. May sentence defendant in criminal cases according to government statutes or sentencing guidelines. May determine liability of defendant in civil cases. May perform wedding ceremonies.","Circuit Court Judge, Circuit Judge, County Judge, Court of Appeals Judge, District Court Judge, Judge, Justice of the Peace, Magisterial District Judge, Magistrate, Superior Court Judge"
https://www.onetonline.org/link/details/23-1012.00,Judicial Law Clerks,23-1012.00,Assist judges in court or by conducting research or preparing legal documents.,"Appellate Law Clerk, Career Judicial Law Clerk, Career Law Clerk, Judicial Assistant, Judicial Clerk, Judicial Law Clerk, Law Clerk, Law Researcher, Pro Se Law Clerk, Term Law Clerk"
https://www.onetonline.org/link/details/25-2012.00,"Kindergarten Teachers, Except Special Education",25-2012.00,Teach academic and social skills to kindergarten students.,"Bilingual Kindergarten Teacher, Classroom Teacher, Educator, Instructor, Kinder Teacher, Kindergarten Classroom Teacher, Teacher, Title One Kindergarten Teacher, Transitional Kindergarten Teacher"
https://www.onetonline.org/link/details/13-1075.00,Labor Relations Specialists,13-1075.00,"Resolve disputes between workers and managers, negotiate collective bargaining agreements, or coordinate grievance procedures to handle employee complaints.","Business Agent, Business Representative, Grievance Manager, Labor Relations Specialist, Labor Specialist"
https://www.onetonline.org/link/details/53-7062.00,"Laborers and Freight, Stock, and Material Movers, Hand",53-7062.00,"Manually move freight, stock, luggage, or other materials, or perform other general labor. Includes all manual laborers not elsewhere classified.","Laborer, Loader, Material Handler, Merchandise Pick Up Associate, Merchandise Receiving Associate, Receiver, Receiving Associate, Shipping and Receiving Materials Handler, Warehouse Worker"
https://www.onetonline.org/link/details/17-1012.00,Landscape Architects,17-1012.00,"Plan and design land areas for projects such as parks and other recreational facilities, airports, highways, hospitals, schools, land subdivisions, and commercial, industrial, and residential sites.","AP BD+C (Accredited Professional in Building Design and Construction), Golf Course Architect, Land Planner, Landscape Architect, Landscape Designer, Landscape Planner, Park Planner, Planner, Professional Landscape Architect (PLA)"
https://www.onetonline.org/link/details/37-3011.00,Landscaping and Groundskeeping Workers,37-3011.00,"Landscape or maintain grounds of property using hand or power tools or equipment. Workers typically perform a variety of tasks, which may include any combination of the following: sod laying, mowing, trimming, planting, watering, fertilizing, digging, raking, sprinkler installation, and installation of mortarless segmental concrete masonry wall units.","Gardener, Greenskeeper, Grounds Maintenance Worker, Grounds Person, Grounds Specialist, Grounds Worker, Groundskeeper, Landscape Specialist, Landscape Technician, Outside Maintenance Worker"
https://www.onetonline.org/link/details/51-4034.00,"Lathe and Turning Machine Tool Setters, Operators, and Tenders, Metal and Plastic",51-4034.00,"Set up, operate, or tend lathe and turning machines to turn, bore, thread, form, or face metal or plastic materials, such as wire, rod, or bar stock.","CNC Lathe Operator (Computer Numerical Control Lathe Operator), CNC Setup Operator (Computer Numerical Control Setup Operator), Lathe Operator, Machine Operator, Numerical Control Operator (NC Operator), Screw Machine Operator, Screw Machine Tool Setter, Setup Operator, Turn Operator"
https://www.onetonline.org/link/details/51-6011.00,Laundry and Dry-Cleaning Workers,51-6011.00,"Operate or tend washing or dry-cleaning machines to wash or dry-clean industrial or household articles, such as cloth garments, suede, leather, furs, blankets, draperies, linens, rugs, and carpets. Includes spotters and dyers of these articles.","Dry Cleaner, Laundry Aide, Laundry Assistant, Laundry Attendant, Laundry Housekeeper, Laundry Technician, Laundry Worker, Personal Clothing Laundry Aide, Spotter"
https://www.onetonline.org/link/details/25-1112.00,"Law Teachers, Postsecondary",25-1112.00,Teach courses in law. Includes both teachers primarily engaged in teaching and those who do a combination of teaching and research.,"Adjunct Professor, Assistant Professor, Associate Professor, Business Law Professor, Clinical Law Professor, Instructor, Law Instructor, Law Professor, Legal Writing Professor, Professor"
https://www.onetonline.org/link/details/23-1011.00,Lawyers,23-1011.00,"Represent clients in criminal and civil litigation and other legal proceedings, draw up legal documents, or manage or advise clients on legal transactions. May specialize in a single area or may practice broadly in many areas of law.","Attorney, Attorney at Law, Attorney General, Counsel, County Attorney, District Attorney, General Counsel, Lawyer, Prosecuting Attorney, Prosecutor"
https://www.onetonline.org/link/details/51-4192.00,"Layout Workers, Metal and Plastic",51-4192.00,"Lay out reference points and dimensions on metal or plastic stock or workpieces, such as sheets, plates, tubes, structural shapes, castings, or machine parts, for further processing. Includes shipfitters.","Development Mechanic, Layout Fabricator, Layout Fitter, Layout Inspector, Layout Man, Layout Mechanic, Layout Technician (Layout Tech), Layout Worker"
https://www.onetonline.org/link/details/43-6012.00,Legal Secretaries and Administrative Assistants,43-6012.00,"Perform secretarial duties using legal terminology, procedures, and documents. Prepare legal papers and correspondence, such as summonses, complaints, motions, and subpoenas. May also assist with legal research.","Confidential Secretary, Legal Administrative Assistant (Legal Admin Assistant), Legal Administrator (Legal Admin), Legal Coordinator, Legal Management Assistant, Legal Office Support Assistant, Legal Practice Assistant, Legal Secretary, Litigation Secretary, Magistrate Assistant"
https://www.onetonline.org/link/details/23-2099.00,"Legal Support Workers, All Other",23-2099.00,All legal support workers not listed separately.,
https://www.onetonline.org/link/details/11-1031.00,Legislators,11-1031.00,"Develop, introduce, or enact laws and statutes at the local, tribal, state, or federal level. Includes only workers in elected positions.",
https://www.onetonline.org/link/details/25-4022.00,Librarians and Media Collections Specialists,25-4022.00,"Administer and maintain libraries or collections of information, for public or private access through reference or borrowing. Work in a variety of settings, such as educational institutions, museums, and corporations, and with various types of informational materials, such as books, periodicals, recordings, films, and databases. Tasks may include acquiring, cataloging, and circulating library materials, and user services such as locating and organizing information, providing instruction on how to access information, and setting up and operating a library's media equipment.","Catalog Librarian, Instructional Technology Specialist, Librarian, Library Media Specialist, Media Specialist, Media Technician, Multimedia Services Coordinator, Reference and Instruction Librarian, Reference Librarian, Technical Services Librarian"
https://www.onetonline.org/link/details/43-4121.00,"Library Assistants, Clerical",43-4121.00,"Compile records, and sort, shelve, issue, and receive library materials such as books, electronic media, pictures, cards, slides and microfilm. Locate library materials for loan and replace material in shelving area, stacks, or files according to identification number and title. Register patrons to permit them to borrow books, periodicals, and other library materials.","Acquisitions Assistant, Cataloging Assistant, Library Aide, Library Assistant, Library Associate, Library Circulation Assistant, Library Clerical Assistant, Library Clerk, Library Services Assistant"
https://www.onetonline.org/link/details/25-1082.00,"Library Science Teachers, Postsecondary",25-1082.00,Teach courses in library science. Includes both teachers primarily engaged in teaching and those who do a combination of teaching and research.,"Assistant Professor, Associate Professor, Classification Instructor, Information Science Professor, Instructor, Lecturer, Library Instructor, Library Science Professor, Library Technology Instructor, Professor"
https://www.onetonline.org/link/details/25-4031.00,Library Technicians,25-4031.00,"Assist librarians by helping readers in the use of library catalogs, databases, and indexes to locate books and other materials; and by answering questions that require only brief consultation of standard reference. Compile records; sort and shelve books or other media; remove or repair damaged books or other media; register patrons; and check materials in and out of the circulation process. Replace materials in shelving area (stacks) or files. Includes bookmobile drivers who assist with providing services in mobile libraries.","Circulation Clerk, Library Aide, Library Assistant, Library Associate, Library Clerk, Library Media Technician, Library Specialist, Library Technical Assistant (LTA), Library Technician, Page Technician"
https://www.onetonline.org/link/details/29-2061.00,Licensed Practical and Licensed Vocational Nurses,29-2061.00,"Care for ill, injured, or convalescing patients or persons with disabilities in hospitals, nursing homes, clinics, private homes, group homes, and similar institutions. May work under the supervision of a registered nurse. Licensing required.","Charge Nurse, Clinic Licensed Practical Nurse (Clinic LPN), Clinic Nurse, Home Health Licensed Practical Nurse (Home Health LPN), Licensed Vocational Nurse (LVN), Office Nurse, Pediatric LPN (Pediatric Licensed Practical Nurse), Private Duty Nurse, Radiation Oncology Nurse, Triage LPN (Triage Licensed Practical Nurse)"
https://www.onetonline.org/link/details/19-1099.00,"Life Scientists, All Other",19-1099.00,All life scientists not listed separately.,
https://www.onetonline.org/link/details/19-4099.00,"Life, Physical, and Social Science Technicians, All Other",19-4099.00,"All life, physical, and social science technicians not listed separately.",
https://www.onetonline.org/link/details/33-9092.00,"Lifeguards, Ski Patrol, and Other Recreational Protective Service Workers",33-9092.00,"Monitor recreational areas, such as pools, beaches, or ski slopes, to provide assistance and protection to participants.","Beach Attendant, Beach Lifeguard, Lifeguard, Marine Safety Officer, Ocean Lifeguard, Ocean Lifeguard Specialist, Pool Attendant, Pool Lifeguard, Ski Patrol Paramedic, Ski Patroller"
https://www.onetonline.org/link/details/53-3033.00,Light Truck Drivers,53-3033.00,"Drive a light vehicle, such as a truck or van, with a capacity of less than 26,001 pounds Gross Vehicle Weight (GVW), primarily to pick up merchandise or packages from a distribution center and deliver. May load and unload vehicle.","Bulk Delivery Driver, Delivery Driver, Driver, Light Truck Driver, Package Car Driver, Package Delivery Driver, Route Driver, Service Provider, Truck Driver, Warehouse Driver"
https://www.onetonline.org/link/details/27-4015.00,Lighting Technicians,27-4015.00,"Set up, maintain, and dismantle light fixtures, lighting control devices, and the associated lighting electrical and rigging equipment used for photography, television, film, video, and live productions. May focus or operate light fixtures, or attach color filters or other lighting accessories.",
https://www.onetonline.org/link/details/47-5044.00,"Loading and Moving Machine Operators, Underground Mining",47-5044.00,"Operate underground loading or moving machine to load or move coal, ore, or rock using shuttle or mine car or conveyors. Equipment may include power shovels, hoisting engines equipped with cable-drawn scraper or scoop, or machines equipped with gathering arms and conveyor.","Coal Hauler Operator, Equipment Operator, Load Haul Dump Operator (LHD Operator), Loader Operator, Loading Machine Operator, Miner Operator, Production Miner, Ram Car Operator, Shuttle Car Operator, Underground Miner"
https://www.onetonline.org/link/details/43-4131.00,Loan Interviewers and Clerks,43-4131.00,"Interview loan applicants to elicit information; investigate applicants' backgrounds and verify references; prepare loan request papers; and forward findings, reports, and documents to appraisal department. Review loan papers to ensure completeness, and complete transactions between loan establishment, borrowers, and sellers upon approval of loan.","Closer, Licensed Loan Officer Assistant, Loan Analyst, Loan Clerk, Loan Closer, Loan Originator, Loan Processor, Mortgage Broker, Mortgage Loan Processor, Mortgage Processor"
https://www.onetonline.org/link/details/13-2072.00,Loan Officers,13-2072.00,"Evaluate, authorize, or recommend approval of commercial, real estate, or credit loans. Advise borrowers on financial status and payment methods. Includes mortgage loan officers and agents, collection analysts, loan servicing officers, loan underwriters, and payday loan officers.","Commercial Banker, Commercial Loan Officer, Corporate Banking Officer, Financial Aid Advisor, Financial Aid Counselor, Financial Aid Officer, Financial Counselor, Loan Counselor, Loan Officer, Mortgage Loan Officer"
https://www.onetonline.org/link/details/39-3093.00,"Locker Room, Coatroom, and Dressing Room Attendants",39-3093.00,"Provide personal items to patrons or customers in locker rooms, dressing rooms, or coatrooms.","Athletic Equipment Manager, Coat Check Attendant, Coat Checker, Coat Room Attendant, Fitting Room Attendant, Ladies Locker Room Attendant, Locker Room Attendant, Spa Attendant"
https://www.onetonline.org/link/details/49-9094.00,Locksmiths and Safe Repairers,49-9094.00,"Repair and open locks, make keys, change locks and safe combinations, and install and repair safes.","Certified Master Locksmith (CML), Certified Master Safe Cracker, Certified Master Safecracker (CMS), Forensic Locksmith, Lock Technician, Locksmith, Registered Safe Technician (RST), Road Service Locksmith, Safe Technician, Vault Technician"
https://www.onetonline.org/link/details/53-4011.00,Locomotive Engineers,53-4011.00,"Drive electric, diesel-electric, steam, or gas-turbine-electric locomotives to transport passengers or freight. Interpret train orders, electronic or manual signals, and railroad rules and regulations.","Locomotive Engineer, Passenger Locomotive Engineer, Railroad Engineer, Through Freight Engineer, Train Engineer, Trainmaster, Transportation Specialist"
https://www.onetonline.org/link/details/11-9081.00,Lodging Managers,11-9081.00,"Plan, direct, or coordinate activities of an organization or department that provides lodging and other accommodations.","Bed and Breakfast Innkeeper, Front Desk Manager, Front Office Director, Front Office Manager, Guest Relations Manager, Guest Services Manager, Hotel Manager, Night Manager, Resort Manager, Rooms Director"
https://www.onetonline.org/link/details/45-4023.00,Log Graders and Scalers,45-4023.00,"Grade logs or estimate the marketable content or value of logs or pulpwood in sorting yards, millpond, log deck, or similar locations. Inspect logs for defects or measure logs to determine volume.","Log Buyer, Log Check Scaler, Log Grader, Log Scaler, Lumber Grader, Scaler, Timber Buyer"
https://www.onetonline.org/link/details/45-4022.00,Logging Equipment Operators,45-4022.00,"Drive logging tractor or wheeled vehicle equipped with one or more accessories, such as bulldozer blade, frontal shear, grapple, logging arch, cable winches, hoisting rack, or crane boom, to fell tree; to skid, load, unload, or stack logs; or to pull stumps or clear brush. Includes operating stand-alone logging machines, such as log chippers.","Delimber Operator, Feller Buncher Operator, Harvester Operator, Loader Operator, Log Processor Operator, Logging Equipment Operator, Logging Shovel Operator, Skidder Driver, Skidder Operator, Yarder Operator"
https://www.onetonline.org/link/details/45-4029.00,"Logging Workers, All Other",45-4029.00,All logging workers not listed separately.,
