url,occupation,soc_code,occupation_description,sample_of_reported_job_titles
https://www.onetonline.org/link/details/29-1292.00,Dental Hygienists,29-1292.00,Administer oral hygiene care to patients. Assess patient oral hygiene problems or needs and maintain health records. Advise patients on oral health maintenance and disease prevention. May provide advanced care such as providing fluoride treatment or administering topical anesthesia.,"Dental Hygienist, Hygienist, Licensed Dental Hygienist, Pediatric Dental Hygienist, Registered Dental Hygienist (RDH)"
https://www.onetonline.org/link/details/51-9081.00,Dental Laboratory Technicians,51-9081.00,Construct and repair full or partial dentures or dental appliances.,"Ceramist, Crown and Bridge Dental Laboratory Technician (Crown and Bridge Dental Lab Tech), Dental Ceramist, Dental Laboratory Technician (Dental Lab Tech), Dental Technician (Dental Tech), Denture Technician (Denture Tech), Metal Finisher, Orthodontic Laboratory Technician (Ortho Lab Tech), Porcelain Technician (Porcelain Tech), Waxer"
https://www.onetonline.org/link/details/29-1029.00,"Dentists, All Other Specialists",29-1029.00,All dentists not listed separately.,
https://www.onetonline.org/link/details/29-1021.00,"Dentists, General",29-1021.00,"Examine, diagnose, and treat diseases, injuries, and malformations of teeth and gums. May treat diseases of nerve, pulp, and other dental tissues affecting oral hygiene and retention of teeth. May fit dental appliances or provide preventive care.","Dental Surgery Doctor (DDS), Dentist, Doctor of Dental Medicine (DMD), Doctor of Dental Surgery (DDS), Family Dentist, General Dentist, Pediatric Dentist"
https://www.onetonline.org/link/details/29-1213.00,Dermatologists,29-1213.00,"Diagnose and treat diseases relating to the skin, hair, and nails. May perform both medical and dermatological surgery functions.","Board Certified Dermatologist, Dermatologist MD (Dermatologist Medical Doctor), Dermatologist Physician, Dermatopathologist, Doctor, MD (Medical Doctor), Mohs Micrographic Surgeon, Mohs Surgeon, Pediatric Dermatologist, Practicing Dermatologist"
https://www.onetonline.org/link/details/47-5011.00,"Derrick Operators, Oil and Gas",47-5011.00,Rig derrick equipment and operate pumps to circulate mud or fluid through drill hole.,"Derrick Hand, Derrick Man, Derrick Operator, Derrick Worker, Floor Hand"
https://www.onetonline.org/link/details/27-1029.00,"Designers, All Other",27-1029.00,All designers not listed separately.,
https://www.onetonline.org/link/details/43-9031.00,Desktop Publishers,43-9031.00,Format typescript and graphic elements using computer software to produce publication-ready material.,"Advertising Associate, Compositor, Computer Typesetter, Design Editor, Desktop Operator, Desktop Publishing Specialist, Electronic Console Display Operator, Electronic Imager, Electronic Publishing Specialist, Publisher"
https://www.onetonline.org/link/details/33-3021.00,Detectives and Criminal Investigators,33-3021.00,"Conduct investigations related to suspected violations of federal, state, or local laws to prevent or solve crimes.","Crime Scene Investigator (CSI), Criminal Investigator, Detective, Fugitive Detective, Fugitive Investigator, Investigator, Narcotics Detective, Narcotics Investigator, Police Detective, Special Agent"
https://www.onetonline.org/link/details/29-2032.00,Diagnostic Medical Sonographers,29-2032.00,Produce ultrasonic recordings of internal organs for use by physicians. Includes vascular technologists.,"Cardiac Sonographer, Diagnostic Medical Sonographer, Medical Sonographer, Registered Diagnostic Medical Sonographer (RDMS), Sonographer, Staff Sonographer, Ultrasonographer, Ultrasound Technician (Ultrasound Tech), Ultrasound Technologist (Ultrasound Tech)"
https://www.onetonline.org/link/details/29-2051.00,Dietetic Technicians,29-2051.00,"Assist in the provision of food service and nutritional programs, under the supervision of a dietitian. May plan and produce meals based on established guidelines, teach principles of food and nutrition, or counsel individuals.","Cook Chill Technician (CCT), Diet Assistant, Diet Clerk, Diet Tech (Diet Technician), Diet Tech (Dietetic Technician), Diet Technician Registered (DTR), Dietary Aide, Dietetic Assistant, Dietetic Technician Registered (DTR), Nutrition Technician"
https://www.onetonline.org/link/details/29-1031.00,Dietitians and Nutritionists,29-1031.00,"Plan and conduct food service or nutritional programs to assist in the promotion of health and control of disease. May supervise activities of a department providing quantity food services, counsel individuals, or conduct nutritional research.","Clinical Dietician, Clinical Dietitian, Clinical Nutritionist, Dietitian, Nutritionist, Oncology Dietitian, Outpatient Dietitian, Registered Dietician, Registered Dietitian, Renal Dietitian"
https://www.onetonline.org/link/details/15-1299.06,Digital Forensics Analysts,15-1299.06,"Conduct investigations on computer-based crimes establishing documentary or physical evidence, such as digital media and logs associated with cyber intrusion incidents. Analyze digital evidence and investigate computer security incidents to derive information in support of system and network vulnerability mitigation. Preserve and present computer-related evidence in support of criminal, fraud, counterintelligence, or law enforcement investigations.",
https://www.onetonline.org/link/details/35-9011.00,Dining Room and Cafeteria Attendants and Bartender Helpers,35-9011.00,"Facilitate food service. Clean tables; remove dirty dishes; replace soiled table linens; set tables; replenish supply of clean linens, silverware, glassware, and dishes; supply service bar with food; and serve items such as water, condiments, and coffee to patrons.","Barback, Buffet Attendant, Bus Boy, Bus Person, Busser, Dining Room Attendant, Food Service Aide, Food Service Helper, Server Assistant, Server's Assistant"
https://www.onetonline.org/link/details/21-2021.00,"Directors, Religious Activities and Education",21-2021.00,"Coordinate or design programs and conduct outreach to promote the religious education or activities of a denominational group. May provide counseling, guidance, and leadership relative to marital, health, financial, and religious problems.","Adult Ministries Director, Campus Ministries Director, Children's Ministries Director, Christian Education Director, Religious Education Coordinator, Religious Education Director, Senior Adults Director, Women's Ministries Director, Youth Ministries Director, Youth Pastor"
https://www.onetonline.org/link/details/27-2091.00,"Disc Jockeys, Except Radio",27-2091.00,"Play prerecorded music for live audiences at venues or events such as clubs, parties, or wedding receptions. May use techniques such as mixing, cutting, or sampling to manipulate recordings. May also perform as emcee (master of ceremonies).",
https://www.onetonline.org/link/details/35-9021.00,Dishwashers,35-9021.00,"Clean dishes, kitchen, food preparation equipment, or utensils.","Dish Machine Operator (DMO), Dish Room Worker, Dish Technician, Dishwasher, Kitchen Helper, Kitchen Steward, Pots and Pans Person, Steward, Utility Aide, Utility Worker"
https://www.onetonline.org/link/details/43-5032.00,"Dispatchers, Except Police, Fire, and Ambulance",43-5032.00,"Schedule and dispatch workers, work crews, equipment, or service vehicles for conveyance of materials, freight, or passengers, or for normal installation, service, or emergency repairs rendered outside the place of business. Duties may include using radio, telephone, or computer to transmit assignments and compiling statistics and reports on work progress.","Aircraft Dispatcher, Charter Coordinator, City Dispatcher, Dispatcher (Dispatch), Mine Dispatcher, Paratransit Dispatcher, School Bus Dispatcher, Taxi Dispatcher, Train Dispatcher, Truck Dispatcher"
https://www.onetonline.org/link/details/15-1299.03,Document Management Specialists,15-1299.03,"Implement and administer enterprise-wide document management systems and related procedures that allow organizations to capture, store, retrieve, share, and destroy electronic records and documents.","Business Records Manager, Certified Document Imaging Architect, Document Control Manager, Document Management Consultant, ECM Consultant (Enterprise Content Management Consultant), Electronic Content Manager, Record Systems Analyst, Records and Information Management Consultant (RIM Consultant), Records and Information Management Specialist (RIM Specialist), Records Manager"
https://www.onetonline.org/link/details/41-9091.00,"Door-to-Door Sales Workers, News and Street Vendors, and Related Workers",41-9091.00,Sell goods or services door-to-door or on the street.,"Direct Sales Coach, Door-to-Door Sales Trainer, Independent Beauty Consultant, Independent Distributor, Independent Sales Associate, Independent Sales Representative, Sales Representative, Street Vendor"
https://www.onetonline.org/link/details/17-3019.00,"Drafters, All Other",17-3019.00,All drafters not listed separately.,
https://www.onetonline.org/link/details/53-7031.00,Dredge Operators,53-7031.00,"Operate dredge to remove sand, gravel, or other materials in order to excavate and maintain navigable channels in waterways.","Dredge Operator, Dredger"
https://www.onetonline.org/link/details/51-4032.00,"Drilling and Boring Machine Tool Setters, Operators, and Tenders, Metal and Plastic",51-4032.00,"Set up, operate, or tend drilling machines to drill, bore, ream, mill, or countersink metal or plastic work pieces.","Bore Mill Operator, CNC Drilling Operator (Computer Numerical Control Drilling Operator), CNC Machinist (Computer Numerical Control Machinist), Drill Operator, Drill Press Operator, Drill Setup Operator, Machine Operator, Punch Operator, Radial Drill Operator, Setup Mill Operator"
https://www.onetonline.org/link/details/53-3031.00,Driver/Sales Workers,53-3031.00,"Drive truck or other vehicle over established routes or within an established territory and sell or deliver goods, such as food products, including restaurant take-out items, or pick up or deliver items such as commercial laundry. May also take orders, collect payment, or stock merchandise at point of delivery.","Delivery Man, Driver, Driver Salesman, Pizza Delivery Driver, Route Delivery Driver, Route Driver, Route Sales Driver, Route Sales Representative, Route Salesman, Sales Route Driver"
https://www.onetonline.org/link/details/47-2081.00,Drywall and Ceiling Tile Installers,47-2081.00,"Apply plasterboard or other wallboard to ceilings or interior walls of buildings. Apply or mount acoustical tiles or blocks, strips, or sheets of shock-absorbing materials to ceilings and walls of buildings to reduce or reflect sound. Materials may be of decorative quality. Includes lathers who fasten wooden, metal, or rockboard lath to walls, ceilings, or partitions of buildings to provide support base for plaster, fireproofing, or acoustical material.","Ceiling Installer, Dry Wall Installer, Drywall Finisher, Drywall Hanger, Drywall Installer, Drywall Mechanic, Drywaller, Exterior Interior Specialist, Metal Framer, Metal Stud Framer"
https://www.onetonline.org/link/details/47-5023.00,"Earth Drillers, Except Oil and Gas",47-5023.00,"Operate a variety of drills such as rotary, churn, and pneumatic to tap subsurface water and salt deposits, to remove core samples during mineral exploration or soil testing, and to facilitate the use of explosives in mining or construction. Includes horizontal and earth boring machine operators.","Blast Hole Driller, Diamond Driller, Drill Operator, Driller, Hard Rock Drill Operator, Highwall Drill Operator, Rock Drill Operator, Underground Drill Operator, Water Well Driller, Well Driller"
https://www.onetonline.org/link/details/25-1063.00,"Economics Teachers, Postsecondary",25-1063.00,Teach courses in economics. Includes both teachers primarily engaged in teaching and those who do a combination of teaching and research.,"Adjunct Professor, Assistant Professor, Associate Professor, Economics Instructor, Economics Lecturer, Economics Professor, Finance Professor, Instructor, Lecturer, Professor"
https://www.onetonline.org/link/details/19-3011.00,Economists,19-3011.00,"Conduct research, prepare reports, or formulate plans to address economic problems related to the production and distribution of goods and services or monetary and fiscal policy. May collect and process economic and statistical data using sampling techniques and econometric methods.","Economic Advisor, Economic Analyst, Economic Consultant, Economic Development Specialist, Economist, Forensic Economist, Project Economist, Research Economist, Revenue Research Analyst, Tax Economist"
https://www.onetonline.org/link/details/27-3041.00,Editors,27-3041.00,"Plan, coordinate, revise, or edit written material. May review proposals and drafts for possible publication.","Acquisitions Editor, Business Editor, Editor, Features Editor, Legal Editor, News Editor, Newspaper Copy Editor, Science Editor, Sports Editor, Web Editor"
https://www.onetonline.org/link/details/11-9039.00,"Education Administrators, All Other",11-9039.00,All education administrators not listed separately.,
https://www.onetonline.org/link/details/11-9032.00,"Education Administrators, Kindergarten through Secondary",11-9032.00,"Plan, direct, or coordinate the academic, administrative, or auxiliary activities of kindergarten, elementary, or secondary schools.","Athletic Director, Elementary Principal, High School Principal, Middle School Principal, Principal, School Administrator, School Superintendent, Special Education Director, Superintendent, Vice Principal"
https://www.onetonline.org/link/details/11-9033.00,"Education Administrators, Postsecondary",11-9033.00,"Plan, direct, or coordinate student instruction, administration, and services, as well as other research and educational activities, at postsecondary institutions, including universities, colleges, and junior and community colleges.","Academic Affairs Vice President (Academic Affairs VP), Academic Dean, Admissions Director, College President, Dean, Financial Aid Director, Institutional Research Director, Provost, Registrar, Students Dean"
https://www.onetonline.org/link/details/11-9031.00,"Education and Childcare Administrators, Preschool and Daycare",11-9031.00,"Plan, direct, or coordinate academic or nonacademic activities of preschools or childcare centers and programs, including before- and after-school care.","Childcare Director, Early Head Start Director, Education Coordinator, Education Director, Education Site Manager, Preschool Director, Preschool Program Director, Principal, Site Coordinator"
https://www.onetonline.org/link/details/25-1081.00,"Education Teachers, Postsecondary",25-1081.00,"Teach courses pertaining to education, such as counseling, curriculum, guidance, instruction, teacher education, and teaching English as a second language. Includes both teachers primarily engaged in teaching and those who do a combination of teaching and research.","Adjunct Instructor, Assistant Professor, Associate Professor, Education Instructor, Education Professor, Faculty Member, Instructor, Lecturer, Professor, Special Education Professor"
https://www.onetonline.org/link/details/25-9099.00,"Educational Instruction and Library Workers, All Other",25-9099.00,All educational instruction and library workers not listed separately.,
https://www.onetonline.org/link/details/21-1012.00,"Educational, Guidance, and Career Counselors and Advisors",21-1012.00,Advise and assist students and provide educational and vocational guidance services.,"Academic Advisor, Academic Counselor, Admissions Counselor, Career Counselor, College Counselor, Elementary School Counselor, Guidance Counselor, School Counselor, Student Services Coordinator, Vocational Counselor"
https://www.onetonline.org/link/details/49-2092.00,"Electric Motor, Power Tool, and Related Repairers",49-2092.00,"Repair, maintain, or install electric motors, wiring, or switches.","Electric Motor Mechanic, Electric Motor Repairman, Electric Motor Winder, Electro Mechanic, Maintenance Technician, Power Tool Repair Technician, Repair Technician, Service Technician, Tool Repair Technician, Tool Technician"
https://www.onetonline.org/link/details/17-3023.00,Electrical and Electronic Engineering Technologists and Technicians,17-3023.00,"Apply electrical and electronic theory and related knowledge, usually under the direction of engineering staff, to design, build, repair, adjust, and modify electrical components, circuitry, controls, and machinery for subsequent evaluation and use by engineering staff in making engineering design decisions.","Communications Technologist, Electrical Engineering Technician, Electrical Technician, Electronics Engineering Technician, Electronics Technician, Engineering Technician (Engineering Tech), Engineering Technologist, System Technologist, Technologist"
https://www.onetonline.org/link/details/51-2022.00,Electrical and Electronic Equipment Assemblers,51-2022.00,"Assemble or modify electrical or electronic equipment, such as computers, test equipment telemetering systems, electric motors, and batteries.","Assembler, Assembly Worker, Electrical Assembler, Electronic Assembler, Electronics Assembler, Factory Assembler, Manufacturing Assembler, Transformer Assembler"
https://www.onetonline.org/link/details/17-3012.00,Electrical and Electronics Drafters,17-3012.00,"Prepare wiring diagrams, circuit board assembly diagrams, and layout drawings used for the manufacture, installation, or repair of electrical equipment.","Computer-Aided Design Operator, Designer, Drafter, Drafting Technician (Drafting Tech), Electrical Designer, Electrical Drafter, Layout Designer, Printed Circuit Board Designer (PCB Designer), Staking Engineer, Staking Technician (Staking Tech)"
https://www.onetonline.org/link/details/49-2093.00,"Electrical and Electronics Installers and Repairers, Transportation Equipment",49-2093.00,"Install, adjust, or maintain mobile electronics communication equipment, including sound, sonar, security, navigation, and surveillance systems on trains, watercraft, or other mobile equipment.","Critical Systems Technician, Electronic Bench Technician, Electronics Mechanic, Locomotive Electrician, Power Technician (Power Tech), Ship Yard Electrical Person"
https://www.onetonline.org/link/details/49-2094.00,"Electrical and Electronics Repairers, Commercial and Industrial Equipment",49-2094.00,"Repair, test, adjust, or install electronic equipment, such as industrial controls, transmitters, and antennas.","Control Technician, E and I Mechanic (Electrical and Instrument Mechanic), E and I Mechanic (Electrical and Instrumentation Mechanic), Electrical and Instrument Technician (E and I Tech), Electrical Maintenance Technician, Electronic Technician, I and C Tech (Instrument and Control Technician), Instrument and Electrical Technician (I and E Tech), Repair Technician, Scale Technician"
https://www.onetonline.org/link/details/49-2095.00,"Electrical and Electronics Repairers, Powerhouse, Substation, and Relay",49-2095.00,"Inspect, test, repair, or maintain electrical equipment in generating stations, substations, and in-service relays.","Electrical and Instrumentation Technician (E and I Technician), Electrical Technician, Instrument and Control Technician (I and C Technician), Instrumentation and Control Technician (I and C Technician), Relay Technician, Substation Electrician, Substation Mechanic, Substation Technician, Substation Wireman, Wireman"
https://www.onetonline.org/link/details/17-2071.00,Electrical Engineers,17-2071.00,"Research, design, develop, test, or supervise the manufacturing and installation of electrical equipment, components, or systems for commercial, industrial, military, or scientific use.","Circuits Engineer, Design Engineer, Electrical Controls Engineer, Electrical Design Engineer, Electrical Engineer, Electrical Project Engineer, Engineer, Instrumentation and Electrical Reliability Engineer (I&E Reliability Engineer), Project Engineer, Test Engineer"
https://www.onetonline.org/link/details/49-9051.00,Electrical Power-Line Installers and Repairers,49-9051.00,Install or repair cables or wires used in electrical power or distribution systems. May erect poles and light or heavy duty transmission towers.,"Class Gloving Electrical Lineman, Class Rubber Gloving Lineman, Electrical Lineman, Electrical Lineworker, Lineworker, Power Lineman, Power Lineman Technician, Service Man, Third Step Lineman, Troubleman"
https://www.onetonline.org/link/details/47-2111.00,Electricians,47-2111.00,"Install, maintain, and repair electrical wiring, equipment, and fixtures. Ensure that work is in accordance with relevant codes. May install or service street lights, intercom systems, or electrical control systems.","Control Electrician, Electrical Journey Person, Electrical Troubleshooter, Electrician, Housing Maintenance Electrician, Industrial Electrician, Inside Wireman, Maintenance Electrician, Paper Mill Electrician, Wireman"
https://www.onetonline.org/link/details/17-3024.00,Electro-Mechanical and Mechatronics Technologists and Technicians,17-3024.00,"Operate, test, maintain, or adjust unmanned, automated, servomechanical, or electromechanical equipment. May operate unmanned submarines, aircraft, or other equipment to observe or record visual information at sites such as oil rigs, crop fields, buildings, or for similar infrastructure, deep ocean exploration, or hazardous waste removal. May assist engineers in testing and designing robotics equipment.","Automation Technician (Automation Tech), Electro-Mechanic, Electromechanical Assembler (EM Assembler), Electromechanical Technician (EM Technician), Electronics Technician (Electronics Tech), Mechanical Technician (Mechanical Tech), Process Control Tech, Product Test Specialist, Test Engineering Technician (Test Engineering Tech), Test Technician (Test Tech)"
https://www.onetonline.org/link/details/51-2023.00,Electromechanical Equipment Assemblers,51-2023.00,"Assemble or modify electromechanical equipment or devices, such as servomechanisms, gyros, dynamometers, magnetic drums, tape drives, brakes, control linkage, actuators, and appliances.","Assembler, Electrical Assembler, Electromechanical Assembler, Electromechanical Equipment Assembler, Electronic Assembler, Electronic Technician, Electronics Assembler, Mechanical Assembler, Production Associate, Wiring Technician"
https://www.onetonline.org/link/details/49-2096.00,"Electronic Equipment Installers and Repairers, Motor Vehicles",49-2096.00,"Install, diagnose, or repair communications, sound, security, or navigation equipment in motor vehicles.","Automotive Technician, Car Audio Installer, Car Electronics Installer, Car Stereo Installer, Electronic Equipment Installer, Electronic Technician, Installation Technician, Installer, Mobile Electronics Installation Specialist, Mobile Electronics Installer"
https://www.onetonline.org/link/details/17-2072.00,"Electronics Engineers, Except Computer",17-2072.00,"Research, design, develop, or test electronic components and systems for commercial, industrial, military, or scientific use employing knowledge of electronic theory and materials properties. Design electronic circuits and components for use in fields such as telecommunications, aerospace guidance and propulsion control, acoustics, or instruments and controls.","Compatibility Test Engineer, Design Engineer, Electronics Design Engineer, Engineer, Evaluation Engineer, Integrated Circuit Design Engineer (IC Design Engineer), Product Engineer, Radio Frequency Engineer (RF Engineer), Research and Development Engineer (R and D Engineer), Test Engineer"
https://www.onetonline.org/link/details/25-2021.00,"Elementary School Teachers, Except Special Education",25-2021.00,Teach academic and social skills to students at the elementary school level.,"Art Teacher, Classroom Teacher, Elementary Classroom Teacher, Elementary School Teacher, Elementary Teacher, Math Teacher (Mathematics Teacher), Music Teacher, Primary Teacher, Reading Teacher, Teacher"
https://www.onetonline.org/link/details/47-4021.00,Elevator and Escalator Installers and Repairers,47-4021.00,"Assemble, install, repair, or maintain electric or hydraulic freight or passenger elevators, escalators, or dumbwaiters.","Elevator Adjuster, Elevator Constructor, Elevator Installer, Elevator Mechanic, Elevator Repair and Maintenance Technician (Elevator Repair and Maintenance Tech), Elevator Service Mechanic, Elevator Service Technician (Elevator Service Tech), Elevator Serviceman, Elevator Technician (Elevator Tech), Elevator Troubleshooter"
https://www.onetonline.org/link/details/43-4061.00,"Eligibility Interviewers, Government Programs",43-4061.00,"Determine eligibility of persons applying to receive assistance from government programs and agency resources, such as welfare, unemployment benefits, social security, and public housing.","Benefits Program Tech (Benefits Program Technician), Business and Employment Specialist, Case Manager, Eligibility Examiner, Eligibility Specialist, Eligibility Worker, Program Eligibility Specialist, Social Welfare Examiner (SWEX), Workforce Advisor, Workforce Services Representative (WSR)"
https://www.onetonline.org/link/details/39-4011.00,Embalmers,39-4011.00,Prepare bodies for interment in conformity with legal requirements.,"Embalmer, Licensed Embalmer, Trade Embalmer"
