url,occupation,soc_code,occupation_description,sample_of_reported_job_titles
https://www.onetonline.org/link/details/13-2011.00,Accountants and Auditors,13-2011.00,"Examine, analyze, and interpret accounting records to prepare financial statements, give advice, or audit and evaluate statements prepared by others. Install or advise on systems of recording costs or other financial and budgetary data.","Accountant, Accounting Officer, Audit Partner, Auditor, Certified Public Accountant (CPA), Cost Accountant, Financial Auditor, General Accountant, Internal Auditor, Revenue Tax Specialist"
https://www.onetonline.org/link/details/27-2011.00,Actors,27-2011.00,"Play parts in stage, television, radio, video, or film productions, or other settings for entertainment, information, or instruction. Interpret serious or comic role by speech, gesture, and body movement to entertain or inform audience. May dance and sing.","Actor, Actress, Comedian, Comic, Community Theater Actor, Ensemble Member, Narrator, Performer, Tour Actor, Voice-Over Artist"
https://www.onetonline.org/link/details/15-2011.00,Actuaries,15-2011.00,"Analyze statistical data, such as mortality, accident, sickness, disability, and retirement rates and construct probability tables to forecast risk and liability for payment of future benefits. May ascertain insurance rates required and cash reserves necessary to ensure payment of future benefits.","Actuarial Analyst, Actuarial Associate, Actuarial Consultant, Actuary, Consulting Actuary, Corporate Actuary, Health Actuary, Pricing Actuary, Product Development Actuary, Reserving Actuary"
https://www.onetonline.org/link/details/29-1291.00,Acupuncturists,29-1291.00,"Diagnose, treat, and prevent disorders by stimulating specific acupuncture points within the body using acupuncture needles. May also use cups, nutritional supplements, therapeutic massage, acupressure, and other alternative health therapies.","Acupuncture Physician, Acupuncture Provider, Acupuncturist, Chinese Medical Doctor, Herbalist, Licensed Acupuncturist (LAC), Oriental Medicine Provider, Traditional Chinese Medicine Doctor, Traditional Chinese Medicine Practitioner"
https://www.onetonline.org/link/details/29-1141.01,Acute Care Nurses,29-1141.01,"Provide advanced nursing care for patients with acute conditions such as heart attacks, respiratory distress syndrome, or shock. May care for pre- and post-operative patients or perform advanced, invasive diagnostic or therapeutic procedures.","Cardiac Interventional Care Nurse, Charge Nurse, Preceptor, Progressive Care Unit RN (Progressive Care Unit Registered Nurse), Staff Nurse"
https://www.onetonline.org/link/details/25-2059.01,Adapted Physical Education Specialists,25-2059.01,"Provide individualized physical education instruction or services to children, youth, or adults with exceptional physical needs due to gross motor developmental delays or other impairments.","Adapted Physical Activity Specialist, Adapted Physical Education Specialist (APE Specialist), Adapted Physical Education Teacher (Adapted PE Teacher), Adapted Physical Educator, Certified Adapted Physical Educator, DAPE Specialist (Developmental Adapted Physical Education Specialist), DAPE Teacher (Developmental Adapted Physical Education Teacher)"
https://www.onetonline.org/link/details/51-9191.00,Adhesive Bonding Machine Operators and Tenders,51-9191.00,"Operate or tend bonding machines that use adhesives to join items for further processing or to form a completed product. Processes include joining veneer sheets into plywood; gluing paper; or joining rubber and rubberized fabric parts, plastic, simulated leather, or other materials.","Coater Operator, Glue Line Operator, Glue Reel Operator, Gluer Machine Operator, Gluing Pressman, Machine Operator, Perfect Bind Machine Operator, Sealer Operator, Utility Worker"
https://www.onetonline.org/link/details/23-1021.00,"Administrative Law Judges, Adjudicators, and Hearing Officers",23-1021.00,"Conduct hearings to recommend or make decisions on claims concerning government programs or other government-related matters. Determine liability, sanctions, or penalties, or recommend the acceptance or rejection of claims or settlements.","Adjudications Specialist, Adjudicator, Administrative Hearings Officer, Administrative Judge, Administrative Law Judge, Appeals Examiner, Appeals Referee, Claims Adjudicator, Hearings Officer, Workers' Compensation Hearings Officer"
https://www.onetonline.org/link/details/11-3012.00,Administrative Services Managers,11-3012.00,"Plan, direct, or coordinate one or more administrative services of an organization, such as records and information management, mail distribution, and other office support services.","Administrative Coordinator, Administrative Director, Administrative Manager, Administrative Officer, Administrator, Business Administrator, Business Manager"
https://www.onetonline.org/link/details/25-3011.00,"Adult Basic Education, Adult Secondary Education, and English as a Second Language Instructors",25-3011.00,"Teach or instruct out-of-school youths and adults in basic education, literacy, or English as a Second Language classes, or in classes for earning a high school equivalency credential.","Adult Basic Education Instructor (ABE Instructor), Adult Basic Education Teacher (ABE Teacher), Adult Education Instructor, Adult Education Teacher, ESL Instructor (English as a Second Language Instructor), ESL Teacher (English as a Second Language Teacher), ESOL Teacher (English for Speakers of Other Languages Teacher), GED Instructor (General Educational Development Instructor), GED Teacher (General Educational Development Teacher), Teacher"
https://www.onetonline.org/link/details/29-1141.02,Advanced Practice Psychiatric Nurses,29-1141.02,"Assess, diagnose, and treat individuals and families with mental health or substance use disorders or the potential for such disorders. Apply therapeutic activities, including the prescription of medication, per state regulations, and the administration of psychotherapy.","Adult Psychiatric Mental Health APRN (Adult Psychiatric Mental Health Advanced Practice Registered Nurse), Advanced Practice Psychiatric Nurse, APN (Advanced Practice Nurse), Board Certified Psychiatric Mental Health Clinical Nurse Specialist (BC PMH-CNS), PMHNP (Psychiatric-Mental Health Nurse Practitioner), Psychiatric APN (Psychiatric Advanced Practice Nurse), Psychiatric Clinical Nurse Specialist (Psychiatric CNS), Psychiatric NP (Psychiatric Nurse Practitioner), Psychiatric Provider, Psychiatry APRN (Psychiatry Advanced Practice Registered Nurse)"
https://www.onetonline.org/link/details/11-2011.00,Advertising and Promotions Managers,11-2011.00,"Plan, direct, or coordinate advertising policies and programs or produce collateral materials, such as posters, contests, coupons, or giveaways, to create extra interest in the purchase of a product or service for a department, an entire organization, or on an account basis.","Account Executive, Advertising Manager (Ad Manager), Advertising Sales Manager (Ad Sales Manager), Classified Advertising Manager (Classified Ad Manager), Communications Director, Communications Manager, Creative Services Director, Marketing and Promotions Manager, Promotions Director, Promotions Manager"
https://www.onetonline.org/link/details/41-3011.00,Advertising Sales Agents,41-3011.00,"Sell or solicit advertising space, time, or media in publications, signage, TV, radio, or Internet establishments or public spaces.","Advertising Account Representative, Advertising Consultant, Advertising Representative, Advertising Sales Representative (Ad Sales Representative), Sales Representative"
https://www.onetonline.org/link/details/17-3021.00,Aerospace Engineering and Operations Technologists and Technicians,17-3021.00,"Operate, install, adjust, and maintain integrated computer/communications systems, consoles, simulators, and other data acquisition, test, and measurement instruments and equipment, which are used to launch, track, position, and evaluate air and space vehicles. May record and interpret test data.","Avionics Installation Technician, Avionics Test Technician, Engineering Technician, Engineering Test Technician, Flight Test Instrument Technician, Instrumentation Technician, Systems Test Technician, Test Technician"
https://www.onetonline.org/link/details/17-2011.00,Aerospace Engineers,17-2011.00,"Perform engineering duties in designing, constructing, and testing aircraft, missiles, and spacecraft. May conduct basic and applied research to evaluate adaptability of materials and equipment to aircraft design and manufacture. May recommend improvements in testing equipment and techniques.","Aeronautical Engineer, Aerospace Engineer, Aerospace Stress Engineer, Avionics Engineer, Design Engineer, Flight Controls Engineer, Flight Test Engineer, Structural Analysis Engineer, Systems Engineer, Test Engineer"
https://www.onetonline.org/link/details/13-1011.00,"Agents and Business Managers of Artists, Performers, and Athletes",13-1011.00,"Represent and promote artists, performers, and athletes in dealings with current or prospective employers. May handle contract negotiation and other business matters for clients.","Agent, Athlete Marketing Agent, Booker, Booking Agent, Entertainment Specialist, Literary Agent, Print Agent, Talent Agent, Talent Representative, Theatrical Agent"
https://www.onetonline.org/link/details/17-2021.00,Agricultural Engineers,17-2021.00,"Apply knowledge of engineering technology and biological science to agricultural problems concerned with power and machinery, electrification, structures, soil and water conservation, and processing of agricultural products.","Agricultural Engineer, Agricultural Systems Specialist, Conservation Engineer, Engineer, Field Engineer, Product Engineer, Product Technology Scientist, Project Engineer, Research Agricultural Engineer, Research Engineer"
https://www.onetonline.org/link/details/45-2091.00,Agricultural Equipment Operators,45-2091.00,"Drive and control equipment to support agricultural activities such as tilling soil; planting, cultivating, and harvesting crops; feeding and herding livestock; or removing animal waste. May perform tasks such as crop baling or hay bucking. May operate stationary equipment to perform post-harvest tasks such as husking, shelling, threshing, and ginning.","Baler Operator, Cutter Operator, Equipment Operator, Farm Equipment Operator, Hay Baler, Loader Operator, Packing Tractor Machine Operator, Rake Operator, Sprayer, Windrower Operator"
https://www.onetonline.org/link/details/45-2011.00,Agricultural Inspectors,45-2011.00,"Inspect agricultural commodities, processing equipment, and facilities, and fish and logging operations, to ensure compliance with regulations and laws governing health, quality, and safety.","Brand Inspector, Consumer Safety Inspector (CSI), Food Inspector, Food Safety and Inspection Service Inspector (FSIS Inspector), Food Sanitarian, Grain Inspector, Inspector, Seed and Fertilizer Specialist, Shipping Point Inspector"
https://www.onetonline.org/link/details/25-1041.00,"Agricultural Sciences Teachers, Postsecondary",25-1041.00,"Teach courses in the agricultural sciences. Includes teachers of agronomy, dairy sciences, fisheries management, horticultural sciences, poultry sciences, range management, and agricultural soil conservation. Includes both teachers primarily engaged in teaching and those who do a combination of teaching and research.","Agriculture Instructor, Agriculture Professor, Agronomy Professor, Animal Science Professor, Associate Professor, Horticulture Instructor, Horticulture Professor, Instructor, Plant Science Professor, Professor"
https://www.onetonline.org/link/details/19-4012.00,Agricultural Technicians,19-4012.00,"Work with agricultural scientists in plant, fiber, and animal research, or assist with animal breeding and nutrition. Set up or maintain laboratory equipment and collect samples from crops or animals. Prepare specimens or record data to assist scientists in biology or related life science experiments. Conduct tests and experiments to improve yield and quality of crops or to increase the resistance of plants and animals to disease or insects.","Agricultural Research Technician (Agricultural Research Tech), Agricultural Research Technologist, Agricultural Technician (Agricultural Tech), Agriculture Assistant, Agronomy Research Technician (Agronomy Research Tech), Field Assistant, Insect Research Technician (Insect Research Tech), Lab Tech (Laboratory Technician), Seed Analyst"
https://www.onetonline.org/link/details/45-2099.00,"Agricultural Workers, All Other",45-2099.00,All agricultural workers not listed separately.,
https://www.onetonline.org/link/details/55-3011.00,Air Crew Members,55-3011.00,"Perform in-flight duties to ensure the successful completion of combat, reconnaissance, transport, and search and rescue missions. Duties include operating aircraft communications and detection equipment, including establishing satellite linkages and jamming enemy communications capabilities; conducting preflight, in-flight, and postflight inspections of onboard equipment; operating and maintaining aircraft weapons and defensive systems; operating and maintaining aircraft in-flight refueling systems; executing aircraft safety and emergency procedures; computing and verifying passenger, cargo, fuel, and emergency and special equipment weight and balance data; and conducting cargo and personnel drops.",
https://www.onetonline.org/link/details/55-1011.00,Air Crew Officers,55-1011.00,"Perform and direct in-flight duties to ensure the successful completion of combat, reconnaissance, transport, and search and rescue missions. Duties include operating aircraft communications and radar equipment, such as establishing satellite linkages and jamming enemy communications capabilities; operating aircraft weapons and defensive systems; conducting preflight, in-flight, and postflight inspections of onboard equipment; and directing cargo and personnel drops.",
https://www.onetonline.org/link/details/53-2021.00,Air Traffic Controllers,53-2021.00,"Control air traffic on and within vicinity of airport, and movement of air traffic between altitude sectors and control centers, according to established procedures and policies. Authorize, regulate, and control commercial airline flights according to government or company regulations to expedite and ensure flight safety.","Air Traffic Control Specialist (ATCS), Air Traffic Controller (ATC), Center Air Traffic Controller (Center ATC), Certified Professional Controller (CPC), Control Tower Operator, Enroute Air Traffic Controller (Enroute ATC), Radar Air Traffic Controller, Terminal Air Traffic Control Specialist (Terminal ATC Specialist), Tower Air Traffic Controller (Tower ATC)"
https://www.onetonline.org/link/details/53-1041.00,Aircraft Cargo Handling Supervisors,53-1041.00,"Supervise and coordinate the activities of ground crew in the loading, unloading, securing, and staging of aircraft cargo or baggage. May determine the quantity and orientation of cargo and compute aircraft center of gravity. May accompany aircraft as member of flight crew and monitor and handle cargo in flight, and assist and brief passengers on safety and emergency procedures. Includes loadmasters.","Cargo Supervisor, Ground Operations Supervisor, Line Service Supervisor (LSS), Loadmaster, Ramp and Cargo Supervisor, Ramp Supervisor"
https://www.onetonline.org/link/details/55-1012.00,Aircraft Launch and Recovery Officers,55-1012.00,"Plan and direct the operation and maintenance of catapults, arresting gear, and associated mechanical, hydraulic, and control systems involved primarily in aircraft carrier takeoff and landing operations. Duties include supervision of readiness and safety of arresting gear, launching equipment, barricades, and visual landing aid systems; planning and coordinating the design, development, and testing of launch and recovery systems; preparing specifications for catapult and arresting gear installations; evaluating design proposals; determining handling equipment needed for new aircraft; preparing technical data and instructions for operation of landing aids; and training personnel in carrier takeoff and landing procedures.",
https://www.onetonline.org/link/details/55-3012.00,Aircraft Launch and Recovery Specialists,55-3012.00,"Operate and maintain catapults, arresting gear, and associated mechanical, hydraulic, and control systems involved primarily in aircraft carrier takeoff and landing operations. Duties include installing and maintaining visual landing aids; testing and maintaining launch and recovery equipment using electric and mechanical test equipment and hand tools; activating airfield arresting systems, such as crash barriers and cables, during emergency landing situations; directing aircraft launch and recovery operations using hand or light signals; and maintaining logs of airplane launches, recoveries, and equipment maintenance.",
https://www.onetonline.org/link/details/49-3011.00,Aircraft Mechanics and Service Technicians,49-3011.00,"Diagnose, adjust, repair, or overhaul aircraft engines and assemblies, such as hydraulic and pneumatic systems.","Aircraft Maintenance Technician (Aircraft Maintenance Tech), Aircraft Mechanic, Aircraft Restorer, Aircraft Technician, Airframe and Powerplant Mechanic (A and P Mechanic), Aviation Maintenance Technician (AMT), Aviation Mechanic, Helicopter Mechanic"
https://www.onetonline.org/link/details/53-6032.00,Aircraft Service Attendants,53-6032.00,"Service aircraft with fuel. May de-ice aircraft, refill water and cooling agents, empty sewage tanks, service air and oxygen systems, or clean and polish exterior.",
https://www.onetonline.org/link/details/51-2011.00,"Aircraft Structure, Surfaces, Rigging, and Systems Assemblers",51-2011.00,"Assemble, fit, fasten, and install parts of airplanes, space vehicles, or missiles, such as tails, wings, fuselage, bulkheads, stabilizers, landing gear, rigging and control equipment, or heating and ventilating systems.","A&P Technician (Airframe and Powerplant Technician), Aircraft Line Assembler, Assembler, Assembly Riveter, Helicopter Technician, Sheet Metal Assembler and Riveter (SMAR), Sheet Metal Mechanic, Structures Mechanic, Structures Technician"
https://www.onetonline.org/link/details/53-2022.00,Airfield Operations Specialists,53-2022.00,"Ensure the safe takeoff and landing of commercial and military aircraft. Duties include coordination between air-traffic control and maintenance personnel, dispatching, using airfield landing and navigational aids, implementing airfield safety procedures, monitoring and maintaining flight records, and applying knowledge of weather information.","Airfield Operations Specialist, Airport Operations Agent, Airport Operations Coordinator, Airport Operations Officer, Airport Operations Specialist, Flight Follower, Operations Agent, Operations Coordinator, Operations Officer, Operations Specialist"
https://www.onetonline.org/link/details/53-2011.00,"Airline Pilots, Copilots, and Flight Engineers",53-2011.00,"Pilot and navigate the flight of fixed-wing aircraft, usually on scheduled air carrier routes, for the transport of passengers and cargo. Requires Federal Air Transport certificate and rating for specific aircraft type used. Includes regional, national, and international airline pilots and flight instructors of airline pilots.","Airbus Captain, Airline Captain, Airline Pilot, Captain, Check Airman, Co-Pilot, Commercial Airline Pilot, First Officer, Line Pilot, Pilot"
https://www.onetonline.org/link/details/29-1229.01,Allergists and Immunologists,29-1229.01,"Diagnose, treat, and help prevent allergic diseases and disease processes affecting the immune system.","Adult and Pediatric Allergy Partner, Allergist, Allergy and Immunology Physician, Allergy and Immunology Specialist, Allergy Physician, Immunologist, Immunology Physician, MD (Medical Doctor), Pediatric Pulmonologist, Physician"
https://www.onetonline.org/link/details/53-3011.00,"Ambulance Drivers and Attendants, Except Emergency Medical Technicians",53-3011.00,"Drive ambulance or assist ambulance driver in transporting sick, injured, or convalescent persons. Assist in lifting patients.","Ambulance Attendant, Ambulance Driver, Chair Car Driver, CPR Ambulance Driver (Cardio Pulmonary Resuscitation Ambulance Driver), Driver, Driver Medic, Emergency Care Attendant (ECA), EMS Driver (Emergency Medical Services Driver), First Responder, Medical Van Driver (Medi-Van Driver)"
https://www.onetonline.org/link/details/39-3091.00,Amusement and Recreation Attendants,39-3091.00,"Perform a variety of attending duties at amusement or recreation facility. May schedule use of recreation facilities, maintain and provide equipment to participants of sporting events or recreational pursuits, or operate amusement concessions and rides.","Activities Attendant, Coaster Attendant, Golf Course Ranger, Golf Course Starter, Recreation Aide, Recreation Attendant, Recreation Clerk, Ride Operator, Ski Lift Operator, Sports Complex Attendant"
https://www.onetonline.org/link/details/29-1071.01,Anesthesiologist Assistants,29-1071.01,Assist anesthesiologists in the administration of anesthesia for surgical and non-surgical procedures. Monitor patient status and provide patient care during surgical treatment.,"Anesthesia Assistant, Anesthesia Technician, Anesthesiologist Assistant, Anesthesiologists' Assistant, Cardiothoracic Anesthesia Technician, Certified Anesthesia Technician, Certified Anesthesiologist Assistant"
https://www.onetonline.org/link/details/29-1211.00,Anesthesiologists,29-1211.00,"Administer anesthetics and analgesics for pain management prior to, during, or after surgery.","Medical Doctor (MD), Obstetrical Anesthesiologist, Staff Anesthesiologist, Staff Anesthetist"
https://www.onetonline.org/link/details/45-2021.00,Animal Breeders,45-2021.00,"Select and breed animals according to their genealogy, characteristics, and offspring. May require knowledge of artificial insemination techniques and equipment use. May involve keeping records on heats, birth intervals, or pedigree.","Animal Technician, Artificial Insemination Technician (AI Technician), Artificial Inseminator, Breeder, Dog Breeder, Large Herd Specialist"
https://www.onetonline.org/link/details/39-2021.00,Animal Caretakers,39-2021.00,"Feed, water, groom, bathe, exercise, or otherwise provide care to promote and maintain the well-being of pets and other animals that are not raised for consumption, such as dogs, cats, race horses, ornamental fish or birds, zoo animals, and mice. Work in settings such as kennels, animal shelters, zoos, circuses, and aquariums. May keep records of feedings, treatments, and animals received or discharged. May clean, disinfect, and repair cages, pens, or fish tanks.","Animal Care Giver (ACG), Aquarist, Dog Bather, Dog Groomer, Groomer, Kennel Attendant, Kennel Technician (Kennel Tech), Pet Groomer, Pet Stylist, Zookeeper"
https://www.onetonline.org/link/details/33-9011.00,Animal Control Workers,33-9011.00,"Handle animals for the purpose of investigations of mistreatment, or control of abandoned, dangerous, or unattended animals.","Animal Attendant, Animal Control Officer, Animal Enforcement Officer, Animal Ordinance Enforcement Officer, Animal Park Code Enforcement Officer, Animal Safety Officer, Community Safety Officer, Community Service Officer, Dog Control Officer"
https://www.onetonline.org/link/details/19-1011.00,Animal Scientists,19-1011.00,"Conduct research in the genetics, nutrition, reproduction, growth, and development of domestic farm animals.","Animal Nutrition Consultant, Animal Nutritionist, Animal Scientist, Beef Cattle Nutritionist, Beef Cattle Specialist, Companion Animal Nutritionist, Dairy Nutrition Consultant, Dairy Research Nutritionist, Research Scientist, Scientist"
https://www.onetonline.org/link/details/39-2011.00,Animal Trainers,39-2011.00,"Train animals for riding, harness, security, performance, or obedience, or for assisting persons with disabilities. Accustom animals to human voice and contact, and condition animals to respond to commands. Train animals according to prescribed standards for show or competition. May train animals to carry pack loads or work as part of pack team.","Agility Instructor, Dog Obedience Instructor, Dog Trainer, Guide Dog Instructor, Guide Dog Mobility Instructor (GDMI), Guide Dog Trainer, Horse Trainer, Racehorse Trainer, Service Dog Trainer, Trainer"
https://www.onetonline.org/link/details/19-3091.00,Anthropologists and Archeologists,19-3091.00,"Study the origin, development, and behavior of human beings. May study the way of life, language, or physical characteristics of people in various parts of the world. May engage in systematic recovery and examination of material evidence, such as tools or pottery remaining from past human cultures, in order to determine the history, customs, and living habits of earlier civilizations.","American Indian Policy Specialist, Applied Anthropologist, Applied Cultural Anthropologist, Archaeologist, Communication and Folklore Specialist, Forensic Anthropologist, Historical Archaeologist, Research Archaeologist, Researcher"
https://www.onetonline.org/link/details/25-1061.00,"Anthropology and Archeology Teachers, Postsecondary",25-1061.00,Teach courses in anthropology or archeology. Includes both teachers primarily engaged in teaching and those who do a combination of teaching and research.,"Adjunct Instructor, Anthropology Instructor, Anthropology Professor, Archaeology Professor, Assistant Professor, Associate Professor, Cultural Anthropology Professor, Instructor, Lecturer, Professor"
